{
  "schema_version": "originagent.evolution.external_validator_artifact.v1",
  "module_digest": "aaaaaaaaaaaaaaaaaaaaaaaaaaaaaaaaaaaaaaaaaaaaaaaaaaaaaaaaaaaaaaaa",
  "validator": "0x6666666666666666666666666666666666666666",
  "operator_group_hash": "1111111111111111111111111111111111111111111111111111111111111111",
  "runner_fingerprint_hash": "2222222222222222222222222222222222222222222222222222222222222222",
  "tool_tests_hash": "2b517d681fb728bf05da53e4a79f53005968476affe5cb239cdedaf4a46a53bc",
  "result_digest": "cb18c111559d1102a7e30d5e8af1ea4f31307ad790f3edf81d6882d90e8ad56e",
  "created_at": "2026-05-22T09:18:00Z"
}
